{
  "schema_version": "1.0.0",
  "record_id": "lfighter:task59:seed7:B_hash_ranked:size10",
  "case_selection": {
    "rule": "Task 58 triplet nearest cohort median recovery and probe nearest suspicious median margin",
    "seed": 7,
    "family_id": "B_hash_ranked",
    "coalition_size": 10,
    "probe_validation_index": 48310,
    "manual_substitution": false
  },
  "experiment": {
    "dataset": "CIC IoT-DIAD 2024",
    "classes": [
      "Benign",
      "BruteForce",
      "DDoS",
      "DoS",
      "Mirai",
      "Recon",
      "Spoofing",
      "Web-Based"
    ],
    "logical_client_count": 20,
    "partition_alpha": 0.5,
    "seed": 7,
    "monitoring_rounds": [
      1,
      2,
      3,
      4
    ],
    "development_and_validation_only": true
  },
  "attack": {
    "attack_type": "targeted_label_flip",
    "source_class": "DDoS",
    "source_class_id": 2,
    "target_class": "Benign",
    "target_class_id": 0,
    "poison_fraction": 1.0,
    "coalition_family": "B_hash_ranked",
    "coalition_size": 10,
    "selected_client_ids": [
      5,
      7,
      8,
      10,
      13,
      14,
      15,
      16,
      18,
      19
    ],
    "exact_poison_pair": true,
    "source_ref": "src:task45_condition"
  },
  "detection": {
    "detector_name": "LFighter D0 frozen detector",
    "decision_authority": "deterministic_pipeline",
    "flagged_client_ids": [
      5,
      7,
      8,
      10,
      13,
      14,
      15,
      16,
      18,
      19
    ],
    "score_records": [],
    "threshold_records": [],
    "summary": {
      "mean_malicious_recall": 1.0,
      "minimum_malicious_recall": 1.0,
      "mean_benign_fpr": 0.025,
      "maximum_benign_fpr": 0.1
    },
    "missing_fields": [
      "Per client detector scores and numeric detector thresholds were not materialized in the selected summary artifacts and are not invented."
    ],
    "source_refs": [
      "src:task45_condition",
      "src:task45_rounds"
    ]
  },
  "reconstruction": {
    "applied": true,
    "method": "center_plus_residual",
    "reconstructed_client_ids": [
      5,
      7,
      8,
      10,
      13,
      14,
      15,
      16,
      18,
      19
    ],
    "preserved_original_sample_weights": true,
    "llm_involvement": false,
    "source_refs": [
      "src:task45_condition"
    ]
  },
  "behavior": {
    "condition_summary": {
      "clean_source_to_target_rate": 0.0564987997599519,
      "plain_source_to_target_rate": 0.1910257051410281,
      "defended_source_to_target_rate": 0.094131326265253,
      "absolute_rate_reduction": 0.0968943788757751,
      "damage_removed_fraction": 0.7202602230483272,
      "clean_macro_f1": 0.3670833905463948,
      "plain_macro_f1": 0.3682271606846404,
      "defended_macro_f1": 0.3594108205566785
    },
    "round_metrics": [
      {
        "round": 1,
        "clean_source_to_target_rate": 0.0182036407281456,
        "plain_source_to_target_rate": 0.2861572314462892,
        "defended_source_to_target_rate": 0.018003600720144,
        "malicious_recall": 1.0,
        "benign_fpr": 0.0,
        "defense_improved_vs_plain": true,
        "source_ref": "src:task45_rounds"
      },
      {
        "round": 2,
        "clean_source_to_target_rate": 0.0985697139427885,
        "plain_source_to_target_rate": 0.1169733946789357,
        "defended_source_to_target_rate": 0.161882376475295,
        "malicious_recall": 1.0,
        "benign_fpr": 0.0,
        "defense_improved_vs_plain": false,
        "source_ref": "src:task45_rounds"
      },
      {
        "round": 3,
        "clean_source_to_target_rate": 0.0272054410882176,
        "plain_source_to_target_rate": 0.2594518903780756,
        "defended_source_to_target_rate": 0.048009601920384,
        "malicious_recall": 1.0,
        "benign_fpr": 0.1,
        "defense_improved_vs_plain": true,
        "source_ref": "src:task45_rounds"
      },
      {
        "round": 4,
        "clean_source_to_target_rate": 0.0820164032806561,
        "plain_source_to_target_rate": 0.1015203040608121,
        "defended_source_to_target_rate": 0.148629725945189,
        "malicious_recall": 1.0,
        "benign_fpr": 0.0,
        "defense_improved_vs_plain": false,
        "source_ref": "src:task45_rounds"
      }
    ],
    "source_refs": [
      "src:task45_condition",
      "src:task45_rounds"
    ]
  },
  "xai": {
    "method": "SHAP GradientExplainer",
    "output": "DDoS_minus_Benign_logit_margin",
    "analysis_rows": 16,
    "feature_count": 69,
    "recovery": {
      "attack_distance": 0.8602368235588074,
      "reconstructed_distance": 0.5201502442359924,
      "distance_reduction": 0.3400865793228149,
      "recovery_fraction": 0.3953406434240675,
      "attack_exceeds_repeat_noise_q95": true
    },
    "top_features": [
      {
        "rank": 1,
        "feature": "Fwd Segment Size Avg",
        "majority_direction": "negative",
        "same_direction_fraction": 0.75,
        "median_absolute_attack_shift": 0.4971334040164947,
        "median_absolute_reconstructed_shift": 0.0641079246997833,
        "recovery_fraction": 0.8710448258317877,
        "source_ref": "src:task57_features"
      },
      {
        "rank": 2,
        "feature": "Packet Length Mean",
        "majority_direction": "negative",
        "same_direction_fraction": 0.8333333333333334,
        "median_absolute_attack_shift": 0.4034549593925476,
        "median_absolute_reconstructed_shift": 0.1013365089893341,
        "recovery_fraction": 0.7488281984638161,
        "source_ref": "src:task57_features"
      },
      {
        "rank": 3,
        "feature": "Average Packet Size",
        "majority_direction": "negative",
        "same_direction_fraction": 0.8333333333333334,
        "median_absolute_attack_shift": 0.3939023017883301,
        "median_absolute_reconstructed_shift": 0.0778509378433227,
        "recovery_fraction": 0.8023597793415352,
        "source_ref": "src:task57_features"
      },
      {
        "rank": 4,
        "feature": "Packet Length Min",
        "majority_direction": "negative",
        "same_direction_fraction": 1.0,
        "median_absolute_attack_shift": 0.3689928948879242,
        "median_absolute_reconstructed_shift": 0.0821887105703353,
        "recovery_fraction": 0.7772620781890694,
        "source_ref": "src:task57_features"
      },
      {
        "rank": 5,
        "feature": "Packet Length Max",
        "majority_direction": "negative",
        "same_direction_fraction": 1.0,
        "median_absolute_attack_shift": 0.3548330068588257,
        "median_absolute_reconstructed_shift": 0.123063325881958,
        "recovery_fraction": 0.6531795985627681,
        "source_ref": "src:task57_features"
      },
      {
        "rank": 7,
        "feature": "Fwd Packet Length Max",
        "majority_direction": "negative",
        "same_direction_fraction": 1.0,
        "median_absolute_attack_shift": 0.3062457740306854,
        "median_absolute_reconstructed_shift": 0.0726181715726852,
        "recovery_fraction": 0.7628761676711039,
        "source_ref": "src:task57_features"
      },
      {
        "rank": 8,
        "feature": "Fwd IAT Mean",
        "majority_direction": "positive",
        "same_direction_fraction": 0.75,
        "median_absolute_attack_shift": 0.2998061776161194,
        "median_absolute_reconstructed_shift": 0.1874410212039947,
        "recovery_fraction": 0.3747926653999781,
        "source_ref": "src:task57_features"
      },
      {
        "rank": 9,
        "feature": "Flow IAT Max",
        "majority_direction": "positive",
        "same_direction_fraction": 0.75,
        "median_absolute_attack_shift": 0.2867967486381531,
        "median_absolute_reconstructed_shift": 0.1463778913021087,
        "recovery_fraction": 0.4896110503442581,
        "source_ref": "src:task57_features"
      },
      {
        "rank": 11,
        "feature": "Flow IAT Mean",
        "majority_direction": "negative",
        "same_direction_fraction": 1.0,
        "median_absolute_attack_shift": 0.2530280351638794,
        "median_absolute_reconstructed_shift": 0.1070877760648727,
        "recovery_fraction": 0.5767750557936598,
        "source_ref": "src:task57_features"
      },
      {
        "rank": 12,
        "feature": "Idle Min",
        "majority_direction": "negative",
        "same_direction_fraction": 0.75,
        "median_absolute_attack_shift": 0.2491986006498336,
        "median_absolute_reconstructed_shift": 0.0647377595305442,
        "recovery_fraction": 0.7402161996025338,
        "source_ref": "src:task57_features"
      }
    ],
    "case_feature_contributions": [
      {
        "state": "Clean",
        "feature": "Fwd IAT Mean",
        "shap_contribution": 0.6214194297790527,
        "absolute_contribution": 0.6214194297790527,
        "probe_validation_index": 48310,
        "source_ref": "src:task58_contributions"
      },
      {
        "state": "Clean",
        "feature": "Average Packet Size",
        "shap_contribution": 0.4263869822025299,
        "absolute_contribution": 0.4263869822025299,
        "probe_validation_index": 48310,
        "source_ref": "src:task58_contributions"
      },
      {
        "state": "Clean",
        "feature": "Flow IAT Mean",
        "shap_contribution": 0.3230790793895721,
        "absolute_contribution": 0.3230790793895721,
        "probe_validation_index": 48310,
        "source_ref": "src:task58_contributions"
      },
      {
        "state": "Clean",
        "feature": "Flow IAT Max",
        "shap_contribution": 0.7040528059005737,
        "absolute_contribution": 0.7040528059005737,
        "probe_validation_index": 48310,
        "source_ref": "src:task58_contributions"
      },
      {
        "state": "Clean",
        "feature": "Fwd Packet Length Min",
        "shap_contribution": 0.3158455491065979,
        "absolute_contribution": 0.3158455491065979,
        "probe_validation_index": 48310,
        "source_ref": "src:task58_contributions"
      },